{
  "meta": {
    "url": "http://localhost:8080/testpage/fixed/",
    "mode": "local",
    "site": "sites/testpage/fixed",
    "script": true,
    "goal": "Buy the canvas tote bag",
    "judge": false,
    "generatedAt": "2026-09-27T02:02:04.835Z"
  },
  "verdicts": {
    "outcome": "done",
    "agentCanComplete": true,
    "screenReaderUserCanComplete": true,
    "blockingFindings": [],
    "unexplainedStuck": false
  },
  "counts": {
    "block": 0,
    "degrade": 0,
    "filteredOut": 0,
    "axeViolations": 0,
    "axeBestPractice": 2
  },
  "timeline": [
    {
      "i": 0,
      "action": {
        "kind": "start",
        "reason": "open page"
      },
      "url": "http://localhost:8080/testpage/fixed/",
      "focus": "(focus on page body)",
      "focusRect": null,
      "seen": [],
      "seenNoise": [],
      "heard": [
        "(focus on page body)"
      ],
      "screenshot": "shots/0000.png",
      "shotSize": {
        "w": 1280,
        "h": 800,
        "dpr": 1
      },
      "findingIds": []
    },
    {
      "i": 1,
      "action": {
        "kind": "press",
        "key": "Tab",
        "reason": "find add-to-cart"
      },
      "url": "http://localhost:8080/testpage/fixed/",
      "focus": "button \"Add Canvas Tote Bag to cart\"",
      "focusRect": {
        "x": 32,
        "y": 211,
        "w": 33,
        "h": 28
      },
      "seen": [],
      "seenNoise": [],
      "heard": [
        "button \"Add Canvas Tote Bag to cart\""
      ],
      "screenshot": "shots/0001.png",
      "shotSize": {
        "w": 1280,
        "h": 800,
        "dpr": 1
      },
      "findingIds": []
    },
    {
      "i": 2,
      "action": {
        "kind": "press",
        "key": "Enter",
        "reason": "add to cart"
      },
      "url": "http://localhost:8080/testpage/fixed/",
      "focus": "button \"Add Canvas Tote Bag to cart\"",
      "focusRect": {
        "x": 32,
        "y": 211,
        "w": 33,
        "h": 28
      },
      "seen": [
        {
          "text": "Added to cart",
          "rect": {
            "x": 32,
            "y": 247,
            "w": 640,
            "h": 19
          }
        }
      ],
      "seenNoise": [],
      "heard": [
        "Added to cart"
      ],
      "screenshot": "shots/0002.png",
      "shotSize": {
        "w": 1280,
        "h": 800,
        "dpr": 1
      },
      "findingIds": []
    },
    {
      "i": 3,
      "action": {
        "kind": "press",
        "key": "Tab",
        "reason": "find checkout"
      },
      "url": "http://localhost:8080/testpage/fixed/",
      "focus": "button \"Checkout\"",
      "focusRect": {
        "x": 32,
        "y": 274,
        "w": 72,
        "h": 21
      },
      "seen": [],
      "seenNoise": [],
      "heard": [
        "button \"Checkout\""
      ],
      "screenshot": "shots/0003.png",
      "shotSize": {
        "w": 1280,
        "h": 800,
        "dpr": 1
      },
      "findingIds": []
    },
    {
      "i": 4,
      "action": {
        "kind": "press",
        "key": "Enter",
        "reason": "open checkout"
      },
      "url": "http://localhost:8080/testpage/fixed/",
      "focus": "textbox \"Card number\"",
      "focusRect": {
        "x": 591,
        "y": 364,
        "w": 153,
        "h": 21
      },
      "seen": [
        {
          "text": "Card number Pay",
          "rect": {
            "x": 0,
            "y": 0,
            "w": 1280,
            "h": 800
          }
        }
      ],
      "seenNoise": [],
      "heard": [
        "textbox \"Card number\"",
        "Card number Pay"
      ],
      "screenshot": "shots/0004.png",
      "shotSize": {
        "w": 1280,
        "h": 800,
        "dpr": 1
      },
      "findingIds": []
    },
    {
      "i": 5,
      "action": {
        "kind": "type",
        "text": "4242 4242",
        "reason": "enter card (short on purpose, to hear the error)"
      },
      "url": "http://localhost:8080/testpage/fixed/",
      "focus": "textbox \"Card number\"",
      "focusRect": {
        "x": 591,
        "y": 364,
        "w": 153,
        "h": 21
      },
      "seen": [],
      "seenNoise": [],
      "heard": [],
      "screenshot": "shots/0005.png",
      "shotSize": {
        "w": 1280,
        "h": 800,
        "dpr": 1
      },
      "findingIds": []
    },
    {
      "i": 6,
      "action": {
        "kind": "press",
        "key": "Tab",
        "reason": "go to Pay"
      },
      "url": "http://localhost:8080/testpage/fixed/",
      "focus": "button \"Pay\"",
      "focusRect": {
        "x": 749,
        "y": 364,
        "w": 39,
        "h": 21
      },
      "seen": [],
      "seenNoise": [
        "Free shipping over $50"
      ],
      "heard": [
        "button \"Pay\""
      ],
      "screenshot": "shots/0006.png",
      "shotSize": {
        "w": 1280,
        "h": 800,
        "dpr": 1
      },
      "findingIds": []
    },
    {
      "i": 7,
      "action": {
        "kind": "press",
        "key": "Enter",
        "reason": "pay"
      },
      "url": "http://localhost:8080/testpage/fixed/",
      "focus": "button \"Pay\"",
      "focusRect": {
        "x": 749,
        "y": 364,
        "w": 39,
        "h": 21
      },
      "seen": [
        {
          "text": "Card number is invalid",
          "rect": {
            "x": 492,
            "y": 401,
            "w": 295,
            "h": 19
          }
        }
      ],
      "seenNoise": [
        "New arrivals this week"
      ],
      "heard": [
        "Card number is invalid"
      ],
      "screenshot": "shots/0007.png",
      "shotSize": {
        "w": 1280,
        "h": 800,
        "dpr": 1
      },
      "findingIds": []
    },
    {
      "i": 8,
      "action": {
        "kind": "press",
        "key": "Tab",
        "reason": "check the dialog's focus cycle"
      },
      "url": "http://localhost:8080/testpage/fixed/",
      "focus": "textbox \"Card number\", Card number is invalid",
      "focusRect": {
        "x": 591,
        "y": 364,
        "w": 153,
        "h": 21
      },
      "seen": [],
      "seenNoise": [],
      "heard": [
        "textbox \"Card number\", Card number is invalid"
      ],
      "screenshot": "shots/0008.png",
      "shotSize": {
        "w": 1280,
        "h": 800,
        "dpr": 1
      },
      "findingIds": []
    },
    {
      "i": 9,
      "action": {
        "kind": "press",
        "key": "Tab",
        "reason": "check the dialog's focus cycle"
      },
      "url": "http://localhost:8080/testpage/fixed/",
      "focus": "button \"Pay\"",
      "focusRect": {
        "x": 749,
        "y": 364,
        "w": 39,
        "h": 21
      },
      "seen": [],
      "seenNoise": [],
      "heard": [
        "button \"Pay\""
      ],
      "screenshot": "shots/0009.png",
      "shotSize": {
        "w": 1280,
        "h": 800,
        "dpr": 1
      },
      "findingIds": []
    },
    {
      "i": 10,
      "action": {
        "kind": "press",
        "key": "Tab",
        "reason": "check the dialog's focus cycle"
      },
      "url": "http://localhost:8080/testpage/fixed/",
      "focus": "textbox \"Card number\", Card number is invalid",
      "focusRect": {
        "x": 591,
        "y": 364,
        "w": 153,
        "h": 21
      },
      "seen": [],
      "seenNoise": [],
      "heard": [
        "textbox \"Card number\", Card number is invalid"
      ],
      "screenshot": "shots/0010.png",
      "shotSize": {
        "w": 1280,
        "h": 800,
        "dpr": 1
      },
      "findingIds": []
    },
    {
      "i": 11,
      "action": {
        "kind": "press",
        "key": "Tab",
        "reason": "check the dialog's focus cycle"
      },
      "url": "http://localhost:8080/testpage/fixed/",
      "focus": "button \"Pay\"",
      "focusRect": {
        "x": 749,
        "y": 364,
        "w": 39,
        "h": 21
      },
      "seen": [],
      "seenNoise": [],
      "heard": [
        "button \"Pay\""
      ],
      "screenshot": "shots/0011.png",
      "shotSize": {
        "w": 1280,
        "h": 800,
        "dpr": 1
      },
      "findingIds": []
    },
    {
      "i": 12,
      "action": {
        "kind": "press",
        "key": "Escape",
        "reason": "leave the dialog"
      },
      "url": "http://localhost:8080/testpage/fixed/",
      "focus": "button \"Checkout\"",
      "focusRect": {
        "x": 32,
        "y": 274,
        "w": 72,
        "h": 21
      },
      "seen": [],
      "seenNoise": [],
      "heard": [
        "button \"Checkout\""
      ],
      "screenshot": "shots/0012.png",
      "shotSize": {
        "w": 1280,
        "h": 800,
        "dpr": 1
      },
      "findingIds": []
    },
    {
      "i": 13,
      "action": {
        "kind": "press",
        "key": "Enter",
        "reason": "reopen checkout"
      },
      "url": "http://localhost:8080/testpage/fixed/",
      "focus": "textbox \"Card number\", Card number is invalid",
      "focusRect": {
        "x": 591,
        "y": 364,
        "w": 153,
        "h": 21
      },
      "seen": [
        {
          "text": "Card number Pay",
          "rect": {
            "x": 0,
            "y": 0,
            "w": 1280,
            "h": 800
          }
        },
        {
          "text": "Card number is invalid",
          "rect": {
            "x": 492,
            "y": 401,
            "w": 295,
            "h": 19
          }
        }
      ],
      "seenNoise": [],
      "heard": [
        "textbox \"Card number\", Card number is invalid",
        "Card number Pay",
        "Card number is invalid"
      ],
      "screenshot": "shots/0013.png",
      "shotSize": {
        "w": 1280,
        "h": 800,
        "dpr": 1
      },
      "findingIds": []
    },
    {
      "i": 14,
      "action": {
        "kind": "type",
        "text": " 4242 4242",
        "reason": "complete the 16-digit card number"
      },
      "url": "http://localhost:8080/testpage/fixed/",